{
  "version": "1.0",
  "extracted_at": "2026-05-28T00:00:00Z",
  "source_stats": {
    "total_subscriptions": 50,
    "total_resource_groups": 600,
    "total_resources": 5000
  },
  "subscription_archetypes": [
    {
      "id": "large-production",
      "weight": 0.15,
      "resource_group_count": {
        "mean": 20,
        "std": 5,
        "min": 12,
        "max": 35
      },
      "resource_count": {
        "mean": 180,
        "std": 40,
        "min": 100,
        "max": 300
      },
      "location_distribution": {
        "eastus": 0.35,
        "westus2": 0.25,
        "westeurope": 0.15,
        "northeurope": 0.1,
        "centralus": 0.08,
        "eastus2": 0.07
      },
      "tag_density": {
        "mean": 6.2,
        "std": 1.8
      }
    },
    {
      "id": "medium-production",
      "weight": 0.3,
      "resource_group_count": {
        "mean": 14,
        "std": 4,
        "min": 8,
        "max": 22
      },
      "resource_count": {
        "mean": 110,
        "std": 30,
        "min": 60,
        "max": 180
      },
      "location_distribution": {
        "eastus": 0.3,
        "westus2": 0.2,
        "westeurope": 0.18,
        "northeurope": 0.12,
        "centralus": 0.1,
        "eastus2": 0.1
      },
      "tag_density": {
        "mean": 4.8,
        "std": 2.0
      }
    },
    {
      "id": "development",
      "weight": 0.35,
      "resource_group_count": {
        "mean": 10,
        "std": 3,
        "min": 4,
        "max": 18
      },
      "resource_count": {
        "mean": 70,
        "std": 25,
        "min": 30,
        "max": 130
      },
      "location_distribution": {
        "eastus": 0.5,
        "westus2": 0.2,
        "westeurope": 0.15,
        "centralus": 0.1,
        "eastus2": 0.05
      },
      "tag_density": {
        "mean": 3.5,
        "std": 1.5
      }
    },
    {
      "id": "sandbox",
      "weight": 0.2,
      "resource_group_count": {
        "mean": 5,
        "std": 2,
        "min": 2,
        "max": 10
      },
      "resource_count": {
        "mean": 25,
        "std": 10,
        "min": 8,
        "max": 50
      },
      "location_distribution": {
        "eastus": 0.7,
        "westus2": 0.2,
        "centralus": 0.1
      },
      "tag_density": {
        "mean": 2.0,
        "std": 1.2
      }
    }
  ],
  "resource_group_templates": [
    {
      "id": "vm-deployment",
      "weight": 0.25,
      "type_set": [
        "Microsoft.Compute/virtualMachines",
        "Microsoft.Network/networkInterfaces",
        "Microsoft.Network/publicIPAddresses",
        "Microsoft.Compute/disks"
      ],
      "resource_count": {
        "mean": 8,
        "std": 3,
        "min": 3,
        "max": 15
      }
    },
    {
      "id": "storage-setup",
      "weight": 0.15,
      "type_set": [
        "Microsoft.Storage/storageAccounts"
      ],
      "resource_count": {
        "mean": 3,
        "std": 1,
        "min": 1,
        "max": 6
      }
    },
    {
      "id": "networking",
      "weight": 0.15,
      "type_set": [
        "Microsoft.Network/virtualNetworks",
        "Microsoft.Network/networkSecurityGroups",
        "Microsoft.Network/routeTables"
      ],
      "resource_count": {
        "mean": 5,
        "std": 2,
        "min": 2,
        "max": 10
      }
    },
    {
      "id": "web-app",
      "weight": 0.15,
      "type_set": [
        "Microsoft.Web/serverfarms",
        "Microsoft.Web/sites"
      ],
      "resource_count": {
        "mean": 4,
        "std": 2,
        "min": 2,
        "max": 8
      }
    },
    {
      "id": "data-platform",
      "weight": 0.1,
      "type_set": [
        "Microsoft.Sql/servers",
        "Microsoft.Sql/servers/databases",
        "Microsoft.KeyVault/vaults"
      ],
      "resource_count": {
        "mean": 6,
        "std": 2,
        "min": 3,
        "max": 10
      }
    },
    {
      "id": "kubernetes",
      "weight": 0.1,
      "type_set": [
        "Microsoft.ContainerService/managedClusters",
        "Microsoft.ContainerRegistry/registries"
      ],
      "resource_count": {
        "mean": 3,
        "std": 1,
        "min": 2,
        "max": 5
      }
    },
    {
      "id": "monitoring",
      "weight": 0.1,
      "type_set": [
        "Microsoft.OperationalInsights/workspaces",
        "Microsoft.ManagedIdentity/userAssignedIdentities"
      ],
      "resource_count": {
        "mean": 2,
        "std": 1,
        "min": 1,
        "max": 4
      }
    }
  ],
  "resource_type_distributions": {
    "Microsoft.Compute/virtualMachines": {
      "frequency": 0.12,
      "property_distributions": {
        "vmSize": {
          "Standard_D2s_v3": 0.3,
          "Standard_B2ms": 0.2,
          "Standard_D4s_v3": 0.18,
          "Standard_E2s_v3": 0.12,
          "Standard_F4s_v2": 0.1,
          "Standard_B1ms": 0.1
        },
        "osType": {
          "Linux": 0.65,
          "Windows": 0.35
        },
        "provisioningState": {
          "Succeeded": 0.92,
          "Failed": 0.05,
          "Creating": 0.03
        }
      },
      "sku_distributions": {
        "name": {
          "Standard_D2s_v3": 0.3,
          "Standard_B2ms": 0.2,
          "Standard_D4s_v3": 0.18,
          "Standard_E2s_v3": 0.12,
          "Standard_F4s_v2": 0.1,
          "Standard_B1ms": 0.1
        }
      }
    },
    "Microsoft.Network/networkInterfaces": {
      "frequency": 0.11,
      "property_distributions": {
        "enableAcceleratedNetworking": {
          "true": 0.45,
          "false": 0.55
        },
        "enableIPForwarding": {
          "true": 0.08,
          "false": 0.92
        },
        "nicType": {
          "Standard": 0.9,
          "Elastic": 0.1
        }
      }
    },
    "Microsoft.Compute/disks": {
      "frequency": 0.1,
      "property_distributions": {
        "diskSizeGB": {
          "32": 0.15,
          "64": 0.2,
          "128": 0.3,
          "256": 0.2,
          "512": 0.1,
          "1024": 0.05
        },
        "osType": {
          "Linux": 0.5,
          "Windows": 0.3,
          "null": 0.2
        }
      },
      "sku_distributions": {
        "name": {
          "Premium_LRS": 0.4,
          "StandardSSD_LRS": 0.35,
          "Standard_LRS": 0.2,
          "Premium_ZRS": 0.05
        },
        "tier": {
          "Premium": 0.45,
          "Standard": 0.55
        }
      }
    },
    "Microsoft.Network/publicIPAddresses": {
      "frequency": 0.06,
      "property_distributions": {
        "publicIPAllocationMethod": {
          "Static": 0.6,
          "Dynamic": 0.4
        },
        "publicIPAddressVersion": {
          "IPv4": 0.92,
          "IPv6": 0.08
        }
      },
      "sku_distributions": {
        "name": {
          "Standard": 0.65,
          "Basic": 0.35
        }
      }
    },
    "Microsoft.Network/networkSecurityGroups": {
      "frequency": 0.06,
      "property_distributions": {
        "securityRuleCount": {
          "3": 0.2,
          "5": 0.3,
          "8": 0.25,
          "12": 0.15,
          "20": 0.1
        },
        "defaultSecurityRulesOnly": {
          "true": 0.15,
          "false": 0.85
        }
      }
    },
    "Microsoft.Storage/storageAccounts": {
      "frequency": 0.08,
      "property_distributions": {
        "accessTier": {
          "Hot": 0.65,
          "Cool": 0.3,
          "Archive": 0.05
        },
        "supportsHttpsTrafficOnly": {
          "true": 0.92,
          "false": 0.08
        },
        "minimumTlsVersion": {
          "TLS1_2": 0.85,
          "TLS1_0": 0.1,
          "TLS1_1": 0.05
        },
        "allowBlobPublicAccess": {
          "true": 0.12,
          "false": 0.88
        }
      },
      "sku_distributions": {
        "name": {
          "Standard_LRS": 0.35,
          "Standard_GRS": 0.25,
          "Standard_RAGRS": 0.2,
          "Premium_LRS": 0.1,
          "Standard_ZRS": 0.1
        },
        "tier": {
          "Standard": 0.9,
          "Premium": 0.1
        }
      }
    },
    "Microsoft.Network/virtualNetworks": {
      "frequency": 0.05,
      "property_distributions": {
        "addressSpacePrefixCount": {
          "1": 0.7,
          "2": 0.2,
          "3": 0.1
        },
        "subnetCount": {
          "1": 0.15,
          "2": 0.25,
          "3": 0.3,
          "4": 0.15,
          "5": 0.1,
          "8": 0.05
        },
        "enableDdosProtection": {
          "true": 0.1,
          "false": 0.9
        }
      }
    },
    "Microsoft.Web/sites": {
      "frequency": 0.06,
      "property_distributions": {
        "kind": {
          "app": 0.5,
          "functionapp": 0.3,
          "app,linux": 0.15,
          "functionapp,linux": 0.05
        },
        "state": {
          "Running": 0.85,
          "Stopped": 0.15
        },
        "httpsOnly": {
          "true": 0.88,
          "false": 0.12
        }
      }
    },
    "Microsoft.Web/serverfarms": {
      "frequency": 0.05,
      "property_distributions": {
        "kind": {
          "app": 0.55,
          "functionapp": 0.25,
          "linux": 0.15,
          "elastic": 0.05
        },
        "reserved": {
          "true": 0.2,
          "false": 0.8
        }
      },
      "sku_distributions": {
        "name": {
          "S1": 0.3,
          "P1v2": 0.25,
          "B1": 0.2,
          "P1v3": 0.15,
          "F1": 0.1
        },
        "tier": {
          "Standard": 0.3,
          "PremiumV2": 0.25,
          "Basic": 0.2,
          "PremiumV3": 0.15,
          "Free": 0.1
        }
      }
    },
    "Microsoft.Sql/servers": {
      "frequency": 0.03,
      "property_distributions": {
        "version": {
          "12.0": 0.95,
          "2.0": 0.05
        },
        "publicNetworkAccess": {
          "Enabled": 0.6,
          "Disabled": 0.4
        },
        "minimalTlsVersion": {
          "1.2": 0.8,
          "1.0": 0.15,
          "1.1": 0.05
        }
      }
    },
    "Microsoft.Sql/servers/databases": {